{
  "gateId": "A",
  "creatorSurface": "DESKTOP",
  "consumerSurface": "MONITOR",
  "threadId": "01a05ccf-9886-7f33-b642-6534e371d1d0",
  "oldTurnId": "01a05ccf-996a-71f0-9be5-609e522488d1",
  "newTurnId": "NOT_OBSERVED",
  "rolloutFile": {
    "identity": "608716722:1407374884663413",
    "sha256": "UNKNOWN",
    "searchScope": "CURRENT_CODEX_HOME_SESSIONS_RECURSIVE",
    "matchCount": 1
  },
  "bytePositions": {
    "before": 423696,
    "resume": 423696,
    "after": 423696
  },
  "tokens": {
    "cumulativeBefore": 29782,
    "cumulativeAfter": 29782,
    "newTurn": "NOT_OBSERVED"
  },
  "model": {
    "before": "gpt-5.6-sol",
    "after": "gpt-5.6-sol"
  },
  "lifecycle": "TASK_COMPLETE",
  "workspace": "CodexMonitor saved-project local checkout",
  "producerSurface": "DESKTOP",
  "states": {
    "threadExists": "PASS",
    "resumable": "FAIL",
    "projectAssigned": "PASS",
    "projectRetained": "NOT_OBSERVED",
    "catalogIndexed": "UNKNOWN",
    "sidebarVisible": "UNKNOWN"
  },
  "occupiedWriterState": "PASS",
  "protocolCalls": [
    {
      "sequence": 1,
      "surface": "DESKTOP",
      "phase": "CREATE",
      "method": "create_thread",
      "requestId": "NOT_OBSERVED",
      "outcome": "PASS",
      "status": "COMPLETED",
      "errorClass": "NOT_OBSERVED",
      "turnCountBefore": 0,
      "turnCountAfter": 1
    },
    {
      "sequence": 2,
      "surface": "MONITOR",
      "phase": "READ",
      "method": "thread/read",
      "requestId": "1788275525255",
      "outcome": "PASS",
      "status": "NOT_LOADED",
      "errorClass": "NOT_OBSERVED",
      "turnCountBefore": 1,
      "turnCountAfter": 1
    },
    {
      "sequence": 3,
      "surface": "MONITOR",
      "phase": "RESUME",
      "method": "thread/resume",
      "requestId": "1788275590208",
      "outcome": "FAIL",
      "status": "REJECTED",
      "errorClass": "ACTIVE_WRITER_-32600",
      "turnCountBefore": 1,
      "turnCountAfter": 1
    },
    {
      "sequence": 4,
      "surface": "MONITOR",
      "phase": "OBSERVE",
      "method": "sanitized rollout snapshot",
      "requestId": "NOT_OBSERVED",
      "outcome": "PASS",
      "status": "UNCHANGED",
      "errorClass": "NOT_OBSERVED",
      "turnCountBefore": 1,
      "turnCountAfter": 1
    },
    {
      "sequence": 5,
      "surface": "MONITOR",
      "phase": "CONTINUE",
      "method": "turn/start via send_user_message",
      "requestId": "1788275584246",
      "outcome": "FAIL",
      "status": "REJECTED",
      "errorClass": "THREAD_NOT_FOUND_-32600",
      "turnCountBefore": 1,
      "turnCountAfter": 1
    }
  ],
  "readResult": "PASS",
  "resumeResult": "FAIL",
  "sameThreadId": "PASS",
  "sameRollout": "PASS",
  "newTurnCreated": "NOT_OBSERVED",
  "tokenContinuity": "PARTIAL",
  "duplicateCount": 0,
  "result": "FAIL"
}
