{
  "gateId": "D",
  "creatorSurface": "MONITOR",
  "consumerSurface": "CLI",
  "threadId": "01a05d7e-8d11-7ab3-b1f1-32f97ce5014c",
  "oldTurnId": "01a05d7e-b521-7f53-8020-85bed5818cb2",
  "newTurnId": "NOT_OBSERVED",
  "rolloutFile": {
    "identity": "608716722:16325548649272332",
    "sha256": "UNKNOWN",
    "searchScope": "CURRENT_CODEX_HOME_SESSIONS_RECURSIVE",
    "matchCount": 1
  },
  "bytePositions": {
    "before": 414327,
    "resume": 414327,
    "after": 414327
  },
  "tokens": {
    "cumulativeBefore": 22542,
    "cumulativeAfter": 22542,
    "newTurn": "NOT_OBSERVED"
  },
  "model": {
    "before": "gpt-5.6-sol",
    "after": "gpt-5.6-sol"
  },
  "lifecycle": "TASK_COMPLETE",
  "workspace": "Phase 3.1.2 dedicated worktree",
  "producerSurface": "MONITOR",
  "states": {
    "threadExists": "PASS",
    "resumable": "FAIL",
    "projectAssigned": "FAIL",
    "projectRetained": "NOT_OBSERVED",
    "catalogIndexed": "PASS",
    "sidebarVisible": "PASS"
  },
  "occupiedWriterState": "UNKNOWN",
  "protocolCalls": [
    {
      "sequence": 1,
      "surface": "MONITOR",
      "phase": "CREATE",
      "method": "thread/start",
      "requestId": "1788274969854",
      "outcome": "PASS",
      "status": "COMPLETED",
      "errorClass": "NOT_OBSERVED",
      "turnCountBefore": 0,
      "turnCountAfter": 0
    },
    {
      "sequence": 2,
      "surface": "MONITOR",
      "phase": "CONTINUE",
      "method": "turn/start via send_user_message",
      "requestId": "1788274980122",
      "outcome": "PASS",
      "status": "COMPLETED",
      "errorClass": "NOT_OBSERVED",
      "turnCountBefore": 0,
      "turnCountAfter": 1
    },
    {
      "sequence": 3,
      "surface": "CLI",
      "phase": "READ",
      "method": "no separate CLI thread/read command",
      "requestId": "NOT_OBSERVED",
      "outcome": "NOT_OBSERVED",
      "status": "NOT_OBSERVED",
      "errorClass": "NOT_OBSERVED",
      "turnCountBefore": 1,
      "turnCountAfter": 1
    },
    {
      "sequence": 4,
      "surface": "CLI",
      "phase": "RESUME",
      "method": "interactive codex resume exact UUID",
      "requestId": "NOT_OBSERVED",
      "outcome": "PARTIAL",
      "status": "AUTH_PROMPT",
      "errorClass": "AUTH_UI_DIVERGENCE",
      "turnCountBefore": 1,
      "turnCountAfter": 1
    },
    {
      "sequence": 5,
      "surface": "CLI",
      "phase": "RESUME",
      "method": "codex exec resume exact UUID",
      "requestId": "NOT_OBSERVED",
      "outcome": "FAIL",
      "status": "REJECTED",
      "errorClass": "NO_ROLLOUT_FOUND_-32600",
      "turnCountBefore": 1,
      "turnCountAfter": 1
    },
    {
      "sequence": 6,
      "surface": "CLI",
      "phase": "OBSERVE",
      "method": "sanitized rollout snapshot",
      "requestId": "NOT_OBSERVED",
      "outcome": "PASS",
      "status": "UNCHANGED",
      "errorClass": "NOT_OBSERVED",
      "turnCountBefore": 1,
      "turnCountAfter": 1
    }
  ],
  "readResult": "NOT_OBSERVED",
  "resumeResult": "FAIL",
  "sameThreadId": "PASS",
  "sameRollout": "PASS",
  "newTurnCreated": "NOT_OBSERVED",
  "tokenContinuity": "PARTIAL",
  "duplicateCount": 0,
  "result": "FAIL"
}
